{
  "$schema": "https://json-schema.org/draft/2020-12/schema",
  "$id": "https://repodossier.local/schemas/patch-workflow-rules.schema.json",
  "title": "RepoDossier patch workflow rules",
  "type": "object",
  "additionalProperties": false,
  "required": [
    "version",
    "categories",
    "severities",
    "rules"
  ],
  "properties": {
    "version": {
      "type": "integer",
      "minimum": 1
    },
    "categories": {
      "type": "array",
      "minItems": 1,
      "uniqueItems": true,
      "items": {
        "type": "string"
      }
    },
    "severities": {
      "type": "array",
      "minItems": 1,
      "uniqueItems": true,
      "items": {
        "type": "string",
        "enum": [
          "must",
          "should",
          "may"
        ]
      }
    },
    "rules": {
      "type": "array",
      "minItems": 1,
      "items": {
        "$ref": "#/$defs/rule"
      }
    }
  },
  "$defs": {
    "rule": {
      "type": "object",
      "additionalProperties": false,
      "required": [
        "id",
        "category",
        "severity",
        "title",
        "description",
        "rationale",
        "applies_to",
        "checks"
      ],
      "properties": {
        "id": {
          "type": "string",
          "pattern": "^[A-Z]+-[0-9]{3}$"
        },
        "category": {
          "type": "string"
        },
        "severity": {
          "type": "string",
          "enum": [
            "must",
            "should",
            "may"
          ]
        },
        "title": {
          "type": "string",
          "minLength": 1
        },
        "description": {
          "type": "string",
          "minLength": 1
        },
        "rationale": {
          "type": "string",
          "minLength": 1
        },
        "applies_to": {
          "type": "array",
          "minItems": 1,
          "uniqueItems": true,
          "items": {
            "type": "string"
          }
        },
        "checks": {
          "type": "array",
          "minItems": 1,
          "items": {
            "type": "string",
            "minLength": 1
          }
        },
        "examples": {
          "type": "array",
          "items": {
            "type": "string"
          }
        }
      }
    }
  }
}
